{
  "schemaVersion": 1,
  "id": "copilot-gemini-auto-speed-20261031",
  "kind": "harness",
  "createdAt": "2026-10-31T15:46:55.795Z",
  "contributor": {
    "name": "Kimono maintainers"
  },
  "llm": {
    "harness": "GitHub Copilot CLI",
    "harnessVersion": "GitHub Copilot CLI 1.0.103",
    "model": "gemini-3.8-flash",
    "notes": "Hybrid search with the auto-speed embedding policy; two runs gathered (run 1 interrupted, plan-config-addon re-run in run 2). Input tokens include cache reads."
  },
  "arms": {
    "without": "GitHub Copilot CLI native read/search tools only",
    "with": "GitHub Copilot CLI native tools plus Kimono MCP (aikido_snapshot, aikido_search, aikido_file)"
  },
  "environment": {
    "os": "darwin",
    "arch": "arm64",
    "node": "v26.12.1"
  },
  "kimono": {
    "commit": "2696ecfed4f6a17c7f89f91a47f05bd068d93109",
    "dirty": true,
    "runtimeSha256": "48611537efb07a8c9c3c956c4c649ff4edfc3841efe94861098ad253c7cfd005",
    "image": "tatami-core-kimono",
    "embeddingPolicy": "auto-speed",
    "indexMode": "all",
    "searchDetail": "compact"
  },
  "corpus": {
    "sha256": "5f7d502d8483bcd37b87ca7acf58ea93fa09cc24f765ff102a00eae63f0e2e07",
    "fileCount": 77,
    "bytes": 854952
  },
  "protocol": {
    "repetitions": 1,
    "timeoutMs": 900000,
    "tasks": [
      {
        "id": "find-ignore-policy",
        "kind": "research",
        "expectedPaths": [
          "src/knowledge.ts",
          "tests/corpus.test.ts"
        ]
      },
      {
        "id": "plan-config-addon",
        "kind": "addon-plan",
        "expectedPaths": [
          "src/corpus-config.ts",
          "src/knowledge.ts",
          "src/snapshots.ts",
          "tests/corpus.test.ts"
        ]
      }
    ],
    "notes": "native read/search in both arms; Kimono additionally available and preferred in with arm Kimono prewarmed once, shared between treatment cells; OS/provider caches uncontrolled"
  },
  "status": "exploratory",
  "cells": [
    {
      "run": "copilot-run",
      "task": "find-ignore-policy",
      "kind": "research",
      "repetition": 1,
      "variant": "without",
      "status": "ok",
      "failure": null,
      "wallMs": 117243,
      "mcpUsed": false,
      "isolationPassed": true,
      "usage": {
        "models": [
          "gemini-3.8-flash"
        ],
        "inputTokens": 291884,
        "outputTokens": 1744,
        "cacheReadTokens": 209338,
        "cacheWriteTokens": 0,
        "reasoningTokens": 6290,
        "uncachedInputTokens": 82546,
        "apiMs": 111527
      },
      "toolCalls": {
        "glob": 3,
        "grep": 9,
        "view": 9
      },
      "quality": {
        "formatValid": true,
        "evidenceValid": true,
        "expectedPathCoverage": 0.5,
        "humanReview": "pending"
      }
    },
    {
      "run": "copilot-run",
      "task": "find-ignore-policy",
      "kind": "research",
      "repetition": 1,
      "variant": "with",
      "status": "ok",
      "failure": null,
      "wallMs": 115951,
      "mcpUsed": true,
      "isolationPassed": true,
      "usage": {
        "models": [
          "gemini-3.8-flash"
        ],
        "inputTokens": 308832,
        "outputTokens": 2191,
        "cacheReadTokens": 227859,
        "cacheWriteTokens": 0,
        "reasoningTokens": 6262,
        "uncachedInputTokens": 80973,
        "apiMs": 109138
      },
      "toolCalls": {
        "kimono-aikido_snapshot": 2,
        "kimono-aikido_search": 1,
        "glob": 1,
        "grep": 7,
        "kimono-aikido_file": 7
      },
      "quality": {
        "formatValid": true,
        "evidenceValid": true,
        "expectedPathCoverage": 1,
        "humanReview": "pending"
      }
    },
    {
      "run": "copilot-run",
      "task": "plan-config-addon",
      "kind": "addon-plan",
      "repetition": 1,
      "variant": "with",
      "status": "ok",
      "failure": null,
      "wallMs": 190114,
      "mcpUsed": true,
      "isolationPassed": true,
      "usage": {
        "models": [
          "gemini-3.8-flash"
        ],
        "inputTokens": 745204,
        "outputTokens": 3643,
        "cacheReadTokens": 580142,
        "cacheWriteTokens": 0,
        "reasoningTokens": 11445,
        "uncachedInputTokens": 165062,
        "apiMs": 183189
      },
      "toolCalls": {
        "kimono-aikido_snapshot": 2,
        "kimono-aikido_search": 13,
        "kimono-aikido_file": 13
      },
      "quality": {
        "formatValid": true,
        "evidenceValid": true,
        "expectedPathCoverage": 1,
        "humanReview": "pending"
      }
    },
    {
      "run": "run-hybrid-plan",
      "task": "plan-config-addon",
      "kind": "addon-plan",
      "repetition": 1,
      "variant": "without",
      "status": "ok",
      "failure": null,
      "wallMs": 338684,
      "mcpUsed": false,
      "isolationPassed": true,
      "usage": {
        "models": [
          "gemini-3.8-flash"
        ],
        "inputTokens": 1668213,
        "outputTokens": 3744,
        "cacheReadTokens": 1368028,
        "cacheWriteTokens": 0,
        "reasoningTokens": 17479,
        "uncachedInputTokens": 300185,
        "apiMs": 332291
      },
      "toolCalls": {
        "glob": 1,
        "grep": 28,
        "view": 31
      },
      "quality": {
        "formatValid": true,
        "evidenceValid": true,
        "expectedPathCoverage": 0.75,
        "humanReview": "pending"
      }
    },
    {
      "run": "run-hybrid-plan",
      "task": "plan-config-addon",
      "kind": "addon-plan",
      "repetition": 1,
      "variant": "with",
      "status": "ok",
      "failure": null,
      "wallMs": 232763,
      "mcpUsed": true,
      "isolationPassed": true,
      "usage": {
        "models": [
          "gemini-3.8-flash"
        ],
        "inputTokens": 937977,
        "outputTokens": 3244,
        "cacheReadTokens": 789908,
        "cacheWriteTokens": 0,
        "reasoningTokens": 10947,
        "uncachedInputTokens": 148069,
        "apiMs": 225523
      },
      "toolCalls": {
        "kimono-aikido_snapshot": 2,
        "kimono-aikido_search": 3,
        "glob": 1,
        "kimono-aikido_file": 1,
        "grep": 13,
        "view": 16
      },
      "quality": {
        "formatValid": true,
        "evidenceValid": true,
        "expectedPathCoverage": 1,
        "humanReview": "pending"
      }
    }
  ],
  "pairs": [
    {
      "run": "copilot-run",
      "task": "find-ignore-policy",
      "repetition": 1,
      "eligibleForClaim": false,
      "reasons": [
        "without: human quality review pending/failed",
        "without: incomplete automatic evidence checks",
        "with: human quality review pending/failed",
        "fewer than 3 repetitions; pilot only"
      ],
      "inputChangePercent": 5.8,
      "uncachedInputChangePercent": -1.9,
      "outputChangePercent": 25.6,
      "wallChangePercent": -1.1
    },
    {
      "run": "run-hybrid-plan",
      "task": "plan-config-addon",
      "repetition": 1,
      "eligibleForClaim": false,
      "reasons": [
        "without: human quality review pending/failed",
        "without: incomplete automatic evidence checks",
        "with: human quality review pending/failed",
        "fewer than 3 repetitions; pilot only"
      ],
      "inputChangePercent": -43.8,
      "uncachedInputChangePercent": -50.7,
      "outputChangePercent": -13.4,
      "wallChangePercent": -31.3
    }
  ],
  "limitations": [
    "Human quality review pending unless status is \"reviewed\"; automatic checks validate format, path bounds and coverage only.",
    "Provider/OS caches and model variability are uncontrolled; input tokens may include cached input and are not a bill.",
    "One run per cell; large run-to-run variance (plan-config-addon with Kimono: 745k vs 938k input tokens).",
    "The run-1 with / run-2 without comparison crosses two runs."
  ]
}
